{
  "$schema": "https://json-schema.org/draft/2020-12/schema",
  "$id": "https://federated-agent-web.dev/schemas/receipt.schema.json",
  "title": "FAW Receipt",
  "description": "Normative signed terminal receipt for the Federated Agent Web contract. Bound to exactly one delegation attempt; accepted issuer-side only against an outstanding pending record.",
  "type": "object",
  "additionalProperties": false,
  "required": ["kind", "spec_version", "id", "issued_at", "issuer", "body", "signature"],
  "properties": {
    "kind": { "const": "faw-receipt" },
    "spec_version": { "enum": ["0.2"] },
    "id": { "type": "string", "pattern": "^[0-9a-f]{8}-[0-9a-f]{4}-[47][0-9a-f]{3}-[89ab][0-9a-f]{3}-[0-9a-f]{12}$" },
    "issued_at": { "type": "string", "pattern": "^\\d{4}-\\d{2}-\\d{2}T\\d{2}:\\d{2}:\\d{2}(\\.\\d{1,9})?Z$" },
    "issuer": {
      "type": "object",
      "additionalProperties": false,
      "required": ["node_id", "kid"],
      "properties": {
        "node_id": { "type": "string", "pattern": "^urn:faw:[a-z0-9](?:[a-z0-9._-]{0,62})$" },
        "kid": { "type": "string", "pattern": "^sha256:[0-9a-f]{64}$" }
      }
    },
    "body": {
      "type": "object",
      "additionalProperties": false,
      "required": [
        "receipt_id", "task_id", "attempt_id", "delegation_digest",
        "executor_node_id", "status", "finished_at", "artifacts", "usage"
      ],
      "properties": {
        "receipt_id": { "type": "string", "pattern": "^[0-9a-f]{8}-[0-9a-f]{4}-[47][0-9a-f]{3}-[89ab][0-9a-f]{3}-[0-9a-f]{12}$" },
        "task_id": { "type": "string", "pattern": "^[0-9a-f]{8}-[0-9a-f]{4}-[47][0-9a-f]{3}-[89ab][0-9a-f]{3}-[0-9a-f]{12}$" },
        "attempt_id": { "type": "string", "pattern": "^[0-9a-f]{8}-[0-9a-f]{4}-[47][0-9a-f]{3}-[89ab][0-9a-f]{3}-[0-9a-f]{12}$" },
        "delegation_digest": { "type": "string", "pattern": "^sha256:[0-9a-f]{64}$" },
        "executor_node_id": { "type": "string", "pattern": "^urn:faw:[a-z0-9](?:[a-z0-9._-]{0,62})$" },
        "status": { "enum": ["succeeded", "failed", "rejected", "timed_out"] },
        "started_at": { "type": "string", "pattern": "^\\d{4}-\\d{2}-\\d{2}T\\d{2}:\\d{2}:\\d{2}(\\.\\d{1,9})?Z$" },
        "finished_at": { "type": "string", "pattern": "^\\d{4}-\\d{2}-\\d{2}T\\d{2}:\\d{2}:\\d{2}(\\.\\d{1,9})?Z$" },
        "artifacts": {
          "type": "array",
          "items": {
            "type": "object",
            "additionalProperties": false,
            "required": ["name", "media_type", "digest", "size", "location"],
            "properties": {
              "name": { "type": "string", "minLength": 1, "maxLength": 128 },
              "media_type": { "type": "string", "pattern": "^[a-z0-9]+/[a-z0-9.+-]+$" },
              "digest": { "type": "string", "pattern": "^sha256:[0-9a-f]{64}$" },
              "size": { "type": "integer", "minimum": 0 },
              "location": { "type": "string", "minLength": 1, "maxLength": 512 }
            }
          }
        },
        "usage": {
          "type": "object",
          "additionalProperties": false,
          "properties": {
            "wall_seconds": { "type": "number", "minimum": 0 },
            "tokens": { "type": "integer", "minimum": 0 },
            "cost_usd": { "type": "string", "pattern": "^(0|[1-9]\\d*)(\\.\\d+)?$" },
            "output_bytes": { "type": "integer", "minimum": 0 }
          }
        },
        "failure": {
          "type": "object",
          "additionalProperties": false,
          "required": ["code", "message"],
          "properties": {
            "code": { "type": "string", "pattern": "^[A-Za-z0-9][A-Za-z0-9._:-]{0,127}$" },
            "message": { "type": "string", "minLength": 1, "maxLength": 2048 }
          }
        },
        "evidence": {
          "type": "array",
          "items": {
            "type": "object",
            "additionalProperties": false,
            "required": ["type", "digest", "location"],
            "properties": {
              "type": { "type": "string", "pattern": "^[A-Za-z0-9][A-Za-z0-9._:-]{0,127}$" },
              "digest": { "type": "string", "pattern": "^sha256:[0-9a-f]{64}$" },
              "location": { "type": "string", "minLength": 1, "maxLength": 512 }
            }
          }
        }
      }
    },
    "signature": {
      "type": "object",
      "additionalProperties": false,
      "required": ["alg", "value"],
      "properties": {
        "alg": { "const": "Ed25519" },
        "value": { "type": "string", "pattern": "^[A-Za-z0-9_-]{86}$" }
      }
    }
  }
}
