{
  "kind": "faw-receipt",
  "spec_version": "0.2",
  "id": "7460c121-b405-4ab0-b192-684ad68c639d",
  "issued_at": "2026-08-03T14:59:10.240188Z",
  "issuer": {
    "node_id": "urn:faw:1d2308009c437575",
    "kid": "sha256:6743e8d9c172869e5604b223140286646f1c13d30e2e07793ed23280d51f045f"
  },
  "body": {
    "receipt_id": "33333333-3333-4333-8333-333333333333",
    "task_id": "11111111-1111-4111-8111-111111111111",
    "attempt_id": "22222222-2222-4222-8222-222222222222",
    "delegation_digest": "sha256:9b3e4e002aa44a04749b25488f9173ce6e2056c56928fdbd58efb5553144a531",
    "executor_node_id": "urn:faw:1d2308009c437575",
    "status": "succeeded",
    "started_at": "2026-08-03T14:59:10.240099Z",
    "finished_at": "2026-08-03T14:59:10.245099Z",
    "artifacts": [
      {
        "name": "result.json",
        "media_type": "application/json",
        "digest": "sha256:01e2f285a05a85fecb3480aa406ebb15c69a67588749cffede2c0158bd43e9c3",
        "size": 330,
        "location": "artifacts/result.json"
      }
    ],
    "usage": {
      "wall_seconds": 0.005,
      "output_bytes": 330
    }
  },
  "signature": {
    "alg": "Ed25519",
    "value": "1ZmuBmmvb1EqnTSEwg-Nm-_zxT0aE41C-EfdlbdzMtdZawoBYWhiwtdH4JwW4u-geI5RHYpbivP46Bg_B7D5Cg"
  }
}
